{
  "result": [
    {
      "ad_id": 2452411,
      "city_name": "Lahore",
      "city_area": "Aabpara Coop Housing Society",
      "seller_comments": "Lightweight allow rims .",
      "rich_description": null,
      "price": "130000000",
      "monthly_installment": 0,
      "remaining_months": 0,
      "discount": null,
      "original_price": null,
      "title": "Honda Civic",
      "url_slug": "/used-cars/honda-civic-2022-for-sale-in-lahore-2452411",
      "pictures_count": 2,
      "pictures": [
        {
          "picture_id": 20172741,
          "picture_thumbnail": "https://marketplace.static2.pakkey.com/20172741.jpg",
          "picture_medium": "https://marketplace.static2.pakkey.com/20172741.jpg",
          "picture_original": "https://marketplace.static2.pakkey.com/20172741.jpg",
          "picture_title": "Honda Civic",
          "picture_alt": "Honda Civic"
        },
        {
          "picture_id": 20172742,
          "picture_thumbnail": "https://marketplace.static2.pakkey.com/20172742.jpg",
          "picture_medium": "https://marketplace.static2.pakkey.com/20172742.jpg",
          "picture_original": "https://marketplace.static2.pakkey.com/20172742.jpg",
          "picture_title": "Honda Civic",
          "picture_alt": "Honda Civic"
        }
      ],
      "klass": "UsedCar",
      "video_link": null,
      "video_id": null,
      "sell_it_for_me_ad": false,
      "sell_it_for_me_eligible": false,
      "status": 3,
      "bumped_count": 0,
      "is_featured": true,
      "ad_listing_id": 2787833,
      "last_updated": "11 Nov 2025",
      "user": {
        "id": 1715121,
        "cnic_verified": false,
        "username": "androidsystem",
        "display_name": "zarnab",
        "member_since": "Nov 11, 2025",
        "city": "Lahore",
        "country": "Pakistan",
        "facebook_verified": false,
        "facebook_uid": null,
        "email_verified": true,
        "mobile_verified": true,
        "mobile_uuid": "f3e2307d6e27f02c6a6849f5a2eca2ff",
        "user_type": 1,
        "dealer_address": "N/A",
        "dealer_timings": "N/A",
        "dealer_name": null,
        "dealer_logo": null,
        "dealer_slug": null
      },
      "featured_request": false,
      "created_at": "11 Nov 2025",
      "is_suzuki_certified": false,
      "is_certified": false,
      "is_certified_requested": false,
      "dealership_id": null,
      "dealership_verified": null,
      "certification_enabled": true,
      "exact_color": "N/A",
      "disclaimer": null,
      "warranty_text": null,
      "recommended_oil": "Havoline\u00ae Eco 5 Sae 5 W 30",
      "oil_widget_name": "Honda Civic 2022",
      "oil_widget_target_url": "https://shell.pakwheels.com/generic-recommender/",
      "oil_logo": "https://marketplace.wsa2.pakkey.com/assets/caltex/Havoline\u00ae ECO 5 SAE 5W-30-a59041d24a24b681c6ccd614c773ce46225540a6255988defdf9e5e8dd7a1db0.jpg",
      "inspection_price": 6500,
      "allow_whatsapp": true,
      "make": "Honda",
      "model": "Civic",
      "version": "N/A",
      "model_year": 2022,
      "engine_capacity": "900cc",
      "engine_type": "Petrol",
      "chassis_no": "",
      "auction_grade": "--",
      "import_date": null,
      "transmission": "Manual",
      "auction_sheet_verified": false,
      "auction_sheet_slug": null,
      "exterior_color": "Red",
      "registration_province": "Punjab",
      "features": "ABS, Alloy Rims",
      "assembly": "Local",
      "mileage": "258 km",
      "registration_city": "Unregistered",
      "body_type": "N/A",
      "air_bags": false,
      "air_conditioning": false,
      "power_windows": false,
      "power_steering": false,
      "power_locks": false,
      "keyless_entry": false,
      "power_mirrors": false,
      "cruise_control": false,
      "abs": true,
      "navigation_system": false,
      "am_fm_radio": false,
      "cassette_player": false,
      "cd_player": false,
      "sun_roof": false,
      "alloy_rims": true,
      "immobilizer_key": false,
      "cool_box": false,
      "dvd_player": false,
      "ad_saved": false,
      "is_user_ad": false,
      "eligible_for_finance": false,
      "offer_detail": null
    },
    {
      "ad_id": 2452410,
      "city_name": "Lahore",
      "city_area": "N/A",
      "seller_comments": "1212121",
      "rich_description": null,
      "price": "212121",
      "monthly_installment": null,
      "remaining_months": null,
      "discount": null,
      "original_price": null,
      "title": "Daihatsu Mira G Smart Drive Package",
      "url_slug": "/used-cars/daihatsu-mira-2023-for-sale-in-lahore-2452410",
      "pictures_count": 1,
      "pictures": [
        {
          "picture_id": 20172744,
          "picture_thumbnail": "https://autoservices.static1.pakkey.com/20172744.jpg",
          "picture_medium": "https://autoservices.static1.pakkey.com/20172744.jpg",
          "picture_original": "https://autoservices.static1.pakkey.com/20172744.jpg",
          "picture_title": "Daihatsu Mira G Smart Drive Package",
          "picture_alt": "Daihatsu Mira G Smart Drive Package"
        }
      ],
      "klass": "UsedCar",
      "video_link": null,
      "video_id": null,
      "sell_it_for_me_ad": false,
      "sell_it_for_me_eligible": false,
      "status": 3,
      "bumped_count": 0,
      "is_featured": true,
      "ad_listing_id": 2787832,
      "last_updated": "11 Nov 2025",
      "user": {
        "id": 1690688,
        "cnic_verified": true,
        "username": "dealersales",
        "display_name": "Dealer iOS",
        "member_since": "Oct 22, 2020",
        "city": "Lahore",
        "country": "Pakistan",
        "facebook_verified": false,
        "facebook_uid": null,
        "email_verified": true,
        "mobile_verified": true,
        "mobile_uuid": "e79e53af3459ebbf0b5ae63babbfb18d",
        "user_type": 2,
        "dealer_address": "TEST",
        "dealer_timings": "06:09 PM to 02:25 PM",
        "dealer_name": "Dealer Sales",
        "dealer_logo": "https://autoservices.static1.pakkey.com/system/dealerships/dealers/000/017/251/thumb/17251.jpg?1757426923",
        "dealer_slug": "dealer-2"
      },
      "featured_request": false,
      "created_at": "11 Nov 2025",
      "is_suzuki_certified": false,
      "is_certified": false,
      "is_certified_requested": false,
      "dealership_id": 17251,
      "dealership_verified": true,
      "certification_enabled": true,
      "exact_color": "N/A",
      "disclaimer": null,
      "warranty_text": null,
      "insurance_company_name": "Pak Qatar Insurance Company Limited",
      "insurance_company_logo": "https://autoservices.static2.pakkey.com/system/insurance_companies/1/medium/images.jpeg?1708515491",
      "insurance_company_id": 1,
      "insurance_rate": 1.9,
      "insurance_rate_with_tracker": 3.0,
      "tracker_amount": 0,
      "final_insurance_amount": 4030,
      "final_insurance_amount_with_tracker": 6364,
      "recommended_oil": "Havoline\u00ae Eco 5 Sae 5 W 30",
      "oil_widget_name": "Daihatsu Mira 2023",
      "oil_widget_target_url": "https://shell.pakwheels.com/generic-recommender/",
      "oil_logo": "https://autoservices.wsa2.pakkey.com/assets/caltex/Havoline\u00ae ECO 5 SAE 5W-30-a59041d24a24b681c6ccd614c773ce46225540a6255988defdf9e5e8dd7a1db0.jpg",
      "inspection_price": 4950,
      "allow_whatsapp": true,
      "make": "Daihatsu",
      "model": "Mira",
      "version": "G Smart Drive Package",
      "model_year": 2023,
      "engine_capacity": "660cc",
      "engine_type": "Petrol",
      "chassis_no": "1212121",
      "auction_grade": "--",
      "import_date": null,
      "transmission": "Automatic",
      "auction_sheet_verified": false,
      "auction_sheet_slug": null,
      "exterior_color": "Gold",
      "registration_province": "Punjab",
      "features": "Air Bags, Air Conditioning, Power Windows, Power Steering, Power Locks, Keyless Entry, Power Mirrors, ABS, AM/FM Radio, CD Player, Immobilizer Key",
      "assembly": "Local",
      "mileage": "2,121 km",
      "registration_city": "Rawalpindi",
      "body_type": "Hatchback",
      "air_bags": true,
      "air_conditioning": true,
      "power_windows": true,
      "power_steering": true,
      "power_locks": true,
      "keyless_entry": true,
      "power_mirrors": true,
      "cruise_control": false,
      "abs": true,
      "navigation_system": false,
      "am_fm_radio": true,
      "cassette_player": false,
      "cd_player": true,
      "sun_roof": false,
      "alloy_rims": false,
      "immobilizer_key": true,
      "cool_box": false,
      "dvd_player": false,
      "ad_saved": false,
      "is_user_ad": false,
      "eligible_for_finance": true,
      "offer_detail": null
    },
    {
      "ad_id": 2452394,
      "city_name": "Lahore",
      "city_area": "Aashiana Road",
      "seller_comments": "Army Officer driven. . Alloy Rims.",
      "rich_description": null,
      "price": "9000000",
      "monthly_installment": 0,
      "remaining_months": 0,
      "discount": null,
      "original_price": null,
      "title": "Honda City",
      "url_slug": "/used-cars/honda-city-2024-for-sale-in-lahore-2452394",
      "pictures_count": 2,
      "pictures": [
        {
          "picture_id": 20172692,
          "picture_thumbnail": "https://marketplace.static2.pakkey.com/20172692.jpg",
          "picture_medium": "https://marketplace.static2.pakkey.com/20172692.jpg",
          "picture_original": "https://marketplace.static2.pakkey.com/20172692.jpg",
          "picture_title": "Honda City",
          "picture_alt": "Honda City"
        },
        {
          "picture_id": 20172693,
          "picture_thumbnail": "https://marketplace.static2.pakkey.com/20172693.jpg",
          "picture_medium": "https://marketplace.static2.pakkey.com/20172693.jpg",
          "picture_original": "https://marketplace.static2.pakkey.com/20172693.jpg",
          "picture_title": "Honda City",
          "picture_alt": "Honda City"
        }